{
  "schema_version": "1.0.0",
  "proposal_id": "ca.sco.segment.500_plus.property_type_second_semantic_execution",
  "proposal_version": "1.0.0",
  "proposal_status": "PROPOSAL_ONLY_NOT_AUTHORIZED",
  "prepared_on": "2026-09-15",
  "jurisdiction": "CA",
  "source_id": "ca.sco.unclaimed_property.bulk",
  "source_segment_id": "ca.sco.unclaimed_property.bulk.500_plus",
  "canonical_base": {
    "branch": "m2-state-governance-core",
    "sha": "e97c1f62959f603bdd3df79538d4b70255594c70",
    "runner_path": "scripts/ca_sco_property_type_semantic_verification.py",
    "future_execution_schema_path": "schemas/common/property_type_semantic_verification_execution.v1_1.schema.json",
    "future_execution_schema_version": "1.1.0"
  },
  "historical_attempt": {
    "workflow_run": "34965097988",
    "schema_version": "1.0.0",
    "result": "STOPPED_FAIL_CLOSED",
    "stop_reason": "PROPERTY_TYPE_FORMAT_UNEXPECTED",
    "root_cause": "UNRESOLVED",
    "execution_approval_ref": "OWNER_CHAT_APPROVAL_2026-09-15_PROPERTY_TYPE_SEMANTIC_EXECUTION_BOUNDED",
    "execution_approval_consumed": true,
    "privacy_approval_ref": "OWNER_CHAT_APPROVAL_2026-09-15_PROPERTY_TYPE_TRANSIENT_ROW_PRIVACY_BOUNDED",
    "privacy_approval_consumed": true,
    "approvals_reusable": false,
    "offending_source_value_or_bytes_persisted": false
  },
  "fresh_authorization_requirements": {
    "execution_approval_status": "REQUIRED_NOT_GRANTED",
    "execution_approval_ref": null,
    "transient_row_privacy_approval_status": "REQUIRED_NOT_GRANTED",
    "transient_row_privacy_approval_ref": null,
    "network_workflow_creation_authorized": false,
    "real_execution_authorized": false,
    "gate": "HUMAN_PROPERTY_TYPE_SECOND_SEMANTIC_EXECUTION_REVIEW"
  },
  "semantic_question": {
    "field": "PROPERTY_TYPE",
    "question_id": "VERIFY_BOUNDED_BULK_PROPERTY_TYPE_SAMPLE_AGAINST_SCO_NAUPA_INSURANCE_SEMANTICS_V1_1",
    "question": "Using the canonical v1.1.0 runner and the unchanged deterministic bounded prefix sample, are PROPERTY_TYPE values NAUPA-style code tokens, and is every observed IN-prefixed value one of the official California SCO insurance codes IN01-IN08 or IN99?",
    "proof_boundary": "SAMPLE_ONLY_DOES_NOT_PROVE_FULL_DATASET_DOMAIN_OR_GLOBAL_CODE_FREQUENCY",
    "production_classification_activation_allowed": false
  },
  "sample_plan": {
    "selection_mode": "FIRST_COMPLETE_DATA_ROWS_AFTER_VERIFIED_HEADER_PER_CANONICAL_MEMBER",
    "canonical_member_count": 4,
    "canonical_members": [
      {"name": "From_500_To_Beyond_1_of_4.csv", "local_header_offset": 0},
      {"name": "From_500_To_Beyond_2_of_4.csv", "local_header_offset": 59747797},
      {"name": "From_500_To_Beyond_3_of_4.csv", "local_header_offset": 96862896},
      {"name": "From_500_To_Beyond_4_of_4.csv", "local_header_offset": 134174190}
    ],
    "data_rows_max_per_member": 4,
    "data_rows_max_total": 16,
    "header_rows_counted_as_data": false,
    "representativeness_claimed": false,
    "sample_bias_note": "Prefix sampling is deterministic and privacy-minimized; it is not statistically representative."
  },
  "transport_caps": {
    "head_requests_max": 1,
    "range_requests_max": 4,
    "http_requests_max_total": 5,
    "range_response_bytes_max_each": 131072,
    "source_response_body_bytes_max_total": 524288,
    "uncompressed_transient_bytes_max_each": 262144,
    "uncompressed_transient_bytes_max_total": 1048576,
    "logical_record_bytes_max": 32768,
    "additional_range_allowed": false,
    "full_body_fallback_allowed": false,
    "automatic_widening_allowed": false
  },
  "row_processing_controls": {
    "expected_column_count": 25,
    "property_type_column_index_zero_based": 1,
    "property_type_code_shape_regex": "^(?:[A-Z]{2}[0-9]{2}|ZZZZ)$",
    "official_insurance_codes": ["IN01", "IN02", "IN03", "IN04", "IN05", "IN06", "IN07", "IN08", "IN99"],
    "trimming_allowed": false,
    "uppercasing_allowed": false,
    "normalization_allowed": false,
    "regex_relaxation_allowed": false
  },
  "privacy_controls": {
    "transient_full_row_bytes_may_be_observed_only_after_fresh_privacy_approval": true,
    "memory_only": true,
    "transient_buffer_retention_days": 0,
    "immediate_disposal": true,
    "raw_body_persistence": false,
    "full_row_persistence": false,
    "property_id_persistence": false,
    "owner_holder_persistence": false,
    "per_row_property_type_persistence": false,
    "offending_bytes_persistence": false,
    "offending_value_hash_persistence": false,
    "offending_value_length_persistence": false,
    "record_values_in_logs": false,
    "derived_summary_persistence_allowed": true,
    "allowed_persisted_derived_fields": [
      "sample_rows_examined",
      "rows_examined_per_member",
      "distinct_property_type_codes",
      "distinct_insurance_codes",
      "semantic_result_status",
      "stop_reason"
    ]
  },
  "v1_1_diagnostic_outcomes": {
    "invalid_utf8_property_type_stop_reason": "PROPERTY_TYPE_ENCODING_UNEXPECTED",
    "decoded_shape_mismatch_stop_reason": "PROPERTY_TYPE_FORMAT_UNEXPECTED",
    "historical_v1_stop_reinterpreted": false
  },
  "stop_conditions": [
    "TRANSPORT_METADATA_DRIFT",
    "RANGE_RESPONSE_NOT_PARTIAL",
    "CONTENT_RANGE_MISMATCH",
    "CANONICAL_MEMBER_METADATA_MISMATCH",
    "HEADER_MISMATCH",
    "CSV_PARSE_ERROR",
    "ROW_COLUMN_COUNT_MISMATCH",
    "PROPERTY_TYPE_EMPTY",
    "PROPERTY_TYPE_ENCODING_UNEXPECTED",
    "PROPERTY_TYPE_FORMAT_UNEXPECTED",
    "UNRECOGNIZED_INSURANCE_PREFIX_CODE",
    "LOGICAL_RECORD_LIMIT_EXCEEDED",
    "UNCOMPRESSED_TRANSIENT_LIMIT_EXCEEDED",
    "ROW_SAMPLE_INCOMPLETE_WITHIN_MEMBER_PREFIX_CAP",
    "ROW_LIMIT_EXCEEDED",
    "REQUEST_LIMIT_EXCEEDED",
    "BYTE_BUDGET_EXCEEDED",
    "UNEXPECTED_RESPONSE_BODY_BEHAVIOR",
    "RUNNER_INTERNAL_ERROR"
  ],
  "implementation_state": {
    "canonical_runner_present": true,
    "canonical_runner_schema_version": "1.1.0",
    "network_workflow_present": false,
    "network_workflow_planned_path": ".github/workflows/ca-sco-property-type-semantic-verification-once.yml",
    "network_request_performed_during_proposal": false,
    "source_body_access_performed_during_proposal": false,
    "proposal_execution_performed": false
  },
  "safety_state": {
    "source_approval_granted": false,
    "source_registry_activation_allowed": false,
    "production_classification_activation_allowed": false,
    "identity_resolution_allowed": false,
    "beneficiary_matching_allowed": false,
    "outreach_allowed": false
  },
  "next_gate": "HUMAN_PROPERTY_TYPE_SECOND_SEMANTIC_EXECUTION_REVIEW"
}
